{
  "kind": "awmp.job",
  "id": "job_demo_verification_kernel_0001",
  "version": "0.1",
  "createdAt": "2026-02-04T22:50:00Z",
  "principal": {
    "id": "ed/ts00",
    "display": "Ed"
  },
  "scope": {
    "summary": "Verification Kernel demo job: deterministic pass/fail fixture (awmp-demo)",
    "details": "This is a canonical demo job for the AWMP Verification Kernel experiment. It targets the in-repo demo project at demo/awmp-demo to demonstrate an objective, machine-checkable acceptance loop: `make ok` must pass; `make fail` must fail with a recognizable message; and `make test` must pass by asserting both behaviors. The point is to prove verifier + evidence bundle + decision rule, not the demo itself.",
    "constraints": [
      "Local/dev only (must not enable chaos in production)",
      "No production deploys",
      "No secret exfiltration"
    ],
    "disallowed": [
      "Do not rotate credentials",
      "Do not access customer data"
    ]
  },
  "acceptance": {
    "criteria": [
      "In demo/awmp-demo, `make ok` exits 0 and prints a success line",
      "In demo/awmp-demo, `make fail` exits non-zero and prints 'Chaos: forced failure' to stderr",
      "In demo/awmp-demo, `make test` exits 0 by asserting both expectations"
    ],
    "tests": [
      {
        "name": "ok path",
        "command": "cd demo/awmp-demo && make ok",
        "expected": "exit 0"
      },
      {
        "name": "fail path (expected failure)",
        "command": "cd demo/awmp-demo && make fail",
        "expected": "exit non-zero; stderr contains 'Chaos: forced failure'"
      },
      {
        "name": "test harness asserts both",
        "command": "cd demo/awmp-demo && make test",
        "expected": "exit 0"
      }
    ]
  },
  "settlement": {
    "rail": "x402",
    "currency": "USDC",
    "amount": 50,
    "escrow": "escrow_demo_0001"
  },
  "milestones": [
    {
      "id": "m1",
      "summary": "Evidence bundle + verifier output for awmp-demo job",
      "deliverables": [
        "PR link",
        "Evidence bundle"
      ],
      "payout": {
        "amount": 50,
        "currency": "USDC"
      }
    }
  ]
}
